{
  "schemaVersion": "1.0",
  "kind": "agentlas-super-ontology-observability-telemetry",
  "state": "export_only",
  "runtimePromotionAllowed": false,
  "defaultDecision": "observability_required_before_runtime_graph_memory_tool_route_release_or_public_write",
  "eventTypes": [
    "source_intake",
    "evidence_packet",
    "belief_update",
    "graph_write",
    "memory_ticket",
    "tool_action",
    "public_export",
    "route_sync",
    "release_seed",
    "repair_event",
    "rollback",
    "emergency_stop"
  ],
  "failureModes": [
    "missing_trace_id",
    "dropped_span",
    "partial_log",
    "stale_metric",
    "redaction_gap",
    "audit_sink_down",
    "clock_skew",
    "sample_bias",
    "alert_suppression",
    "replay_not_recorded",
    "repair_without_snapshot",
    "cross_surface_correlation_missing"
  ],
  "requiredTelemetry": [
    "trace_id",
    "span_id",
    "parent_span_id",
    "correlation_id",
    "source_ref",
    "evidence_ref",
    "actor_role",
    "authority_state",
    "decision_state",
    "risk_tier",
    "redaction_policy",
    "retention_policy",
    "clock_source",
    "checksum",
    "before_snapshot_ref",
    "after_snapshot_ref",
    "rollback_ref",
    "alert_ref",
    "audit_sink_ref",
    "sample_size"
  ],
  "traceStates": [
    "complete",
    "partial",
    "missing",
    "corrupted",
    "untrusted",
    "redacted"
  ],
  "auditChannels": [
    "jsonl_ledger",
    "otel_trace",
    "memory_ticket",
    "sync_log",
    "release_log",
    "tool_receipt",
    "owner_review_queue"
  ],
  "decisions": [
    "allow_read",
    "candidate_only",
    "shadow_required",
    "sync_review_required",
    "quarantine",
    "rollback",
    "emergency_stop",
    "blocked"
  ],
  "researchBasis": [
    "agent_execution_provenance",
    "agent_observability_telemetry",
    "trace_reasoning_benchmark",
    "opentelemetry",
    "w3c_trace_context",
    "sre_monitoring",
    "nist_ai_rmf_gai_profile",
    "runtime_assurance",
    "audit_log_invariants",
    "data_observability"
  ],
  "hardStops": [
    "missing_observability_telemetry_contract",
    "write_without_trace_id",
    "memory_ticket_without_span_lineage",
    "tool_action_without_audit_receipt",
    "public_export_with_stale_metric",
    "route_sync_without_correlation_id",
    "release_seed_when_audit_sink_down",
    "redaction_missing_in_telemetry",
    "metric_green_without_sample_size",
    "alert_suppressed_during_degraded_mode",
    "shadow_replay_not_recorded",
    "repair_without_before_after_snapshot",
    "rollback_without_observed_event",
    "unobservable_runtime_write"
  ]
}
